{
  "fault_events": [],
  "history_hash": "adf7255cd202e141755a42c4bb854cb5e813f3d2ac63d0ef424aa581c058cdfe",
  "manifest": {
    "adversarial": false,
    "campaign_id": "experiment",
    "campaign_ordinal": 1062,
    "causal_session": false,
    "checker_version": "history.v1",
    "configuration_id": "C7",
    "driver_version": "4.18.1",
    "image_digest": [
      "mongo@sha256:c1a84ab5d0c17deed1e0dba1d24bd7c76e5c7b281145fe536911939b1551754c"
    ],
    "members": [
      {
        "actual_role": "RSPrimary",
        "address": "mongo1:27017"
      },
      {
        "actual_role": "RSSecondary",
        "address": "mongo2:27017"
      },
      {
        "actual_role": "RSSecondary",
        "address": "mongo3:27017"
      }
    ],
    "namespace": {
      "collection": "logical",
      "database": "mc_experiment_01062_C7_mw",
      "document_id": "experiment-01062-C7-mw/x"
    },
    "prediction_commit": "e1bae03e82d1b372008ed3a64fc59c19c76c0a27",
    "prediction_manifest_hash": "663b06ed344c53ea75736e0322b3588ee94c5b8a2e344fc4710f0de925731857",
    "property": "MW",
    "property_steps": {
      "first_write": "first_write",
      "observer": "observer",
      "second_write": "second_write"
    },
    "read_concern": "majority",
    "retry_reads": false,
    "retry_writes": false,
    "runner_version": "e1bae03e82d1b372008ed3a64fc59c19c76c0a27",
    "schedule_id": "mw-election",
    "schema_version": "manifest.v1",
    "seed": 20261977,
    "session_id": "Binary(b'\\xcf\\x10U\\xe1\\xa3\\x0cE\\xd3\\xb3^\\xe3}\\xf7\\x02t\\xb9', 4)",
    "software_versions": {
      "docker_compose": "5.5.1",
      "docker_engine": "29.8.0",
      "mongodb": "7.0.34",
      "pymongo": "4.18.1",
      "python": "3.14.7"
    },
    "subtrial_finished_ns": 12014195648428,
    "subtrial_started_ns": 12014142638052,
    "timeout_policy": {
      "connect_ms": 2000,
      "election_barrier_ms": 30000,
      "operation_ms": 5000,
      "server_selection_ms": 5000,
      "subtrial_ms": 60000,
      "write_concern_ms": 5000
    },
    "trial_id": "experiment-01062-C7-mw",
    "write_concern": "w:1"
  },
  "metadata": {},
  "operations": [
    {
      "actual_role": "RSPrimary",
      "actual_server_address": "mongo1:27017",
      "causal_session": false,
      "command_name": "update",
      "dependency_metadata": {},
      "depends_on_read_id": null,
      "depends_on_version": null,
      "document_version_after": 0,
      "document_version_before": null,
      "end_ns": 12014183539522,
      "error_code": null,
      "error_message": null,
      "fault_event_id": null,
      "key": "x",
      "kind": "setup",
      "observed_updates": [],
      "observed_version": null,
      "observed_versions": [],
      "operation_id": "init",
      "operation_status": "SUCCESS",
      "parent_write_id": null,
      "property": "MW",
      "read_concern": null,
      "requested_member": "primary",
      "response_received": true,
      "session_id": "Binary(b'\\xcf\\x10U\\xe1\\xa3\\x0cE\\xd3\\xb3^\\xe3}\\xf7\\x02t\\xb9', 4)",
      "start_ns": 12014163552915,
      "timeout_category": null,
      "trial_id": "experiment-01062-C7-mw",
      "version": null,
      "write_concern": "w:1",
      "write_id": null
    },
    {
      "actual_role": "RSPrimary",
      "actual_server_address": "mongo1:27017",
      "causal_session": false,
      "command_name": "update",
      "dependency_metadata": {
        "depends_on_read_id": null,
        "depends_on_version": null,
        "parent_write_id": null
      },
      "depends_on_read_id": null,
      "depends_on_version": null,
      "document_version_after": 1,
      "document_version_before": 0,
      "end_ns": 12014188826420,
      "error_code": null,
      "error_message": null,
      "fault_event_id": null,
      "key": "x",
      "kind": "write",
      "observed_updates": [],
      "observed_version": null,
      "observed_versions": [],
      "operation_id": "first_write",
      "operation_status": "SUCCESS",
      "parent_write_id": null,
      "property": "MW",
      "read_concern": null,
      "requested_member": "primary",
      "response_received": true,
      "session_id": "Binary(b'\\xcf\\x10U\\xe1\\xa3\\x0cE\\xd3\\xb3^\\xe3}\\xf7\\x02t\\xb9', 4)",
      "start_ns": 12014186272646,
      "timeout_category": null,
      "trial_id": "experiment-01062-C7-mw",
      "version": 1,
      "write_concern": "w:1",
      "write_id": "w1"
    },
    {
      "actual_role": "RSPrimary",
      "actual_server_address": "mongo1:27017",
      "causal_session": false,
      "command_name": "update",
      "dependency_metadata": {
        "depends_on_read_id": null,
        "depends_on_version": null,
        "parent_write_id": "w1"
      },
      "depends_on_read_id": null,
      "depends_on_version": null,
      "document_version_after": 2,
      "document_version_before": 1,
      "end_ns": 12014193243901,
      "error_code": null,
      "error_message": null,
      "fault_event_id": null,
      "key": "x",
      "kind": "write",
      "observed_updates": [],
      "observed_version": null,
      "observed_versions": [],
      "operation_id": "second_write",
      "operation_status": "SUCCESS",
      "parent_write_id": "w1",
      "property": "MW",
      "read_concern": null,
      "requested_member": "primary",
      "response_received": true,
      "session_id": "Binary(b'\\xcf\\x10U\\xe1\\xa3\\x0cE\\xd3\\xb3^\\xe3}\\xf7\\x02t\\xb9', 4)",
      "start_ns": 12014189721398,
      "timeout_category": null,
      "trial_id": "experiment-01062-C7-mw",
      "version": 2,
      "write_concern": "w:1",
      "write_id": "w2"
    },
    {
      "actual_role": "RSPrimary",
      "actual_server_address": "mongo1:27017",
      "causal_session": false,
      "command_name": "find",
      "dependency_metadata": {},
      "depends_on_read_id": null,
      "depends_on_version": null,
      "document_version_after": null,
      "document_version_before": null,
      "end_ns": 12014195420446,
      "error_code": null,
      "error_message": null,
      "fault_event_id": null,
      "key": "x",
      "kind": "observer",
      "observed_updates": [],
      "observed_version": null,
      "observed_versions": [],
      "operation_id": "observer",
      "operation_status": "SUCCESS",
      "parent_write_id": null,
      "property": "MW",
      "read_concern": "majority",
      "requested_member": "primary",
      "response_received": true,
      "session_id": "Binary(b'\\xcf\\x10U\\xe1\\xa3\\x0cE\\xd3\\xb3^\\xe3}\\xf7\\x02t\\xb9', 4)",
      "start_ns": 12014193682657,
      "timeout_category": null,
      "trial_id": "experiment-01062-C7-mw",
      "version": null,
      "write_concern": "w:1",
      "write_id": null
    }
  ],
  "schema_version": "history.v1"
}
