{
  "fault_events": [
    {
      "action": "isolate",
      "applied_ns": 8446632993581,
      "end_ns": 8446632993784,
      "event_id": "experiment-00517-C4-ryw-ryw-fault",
      "members": [
        "mongo1"
      ],
      "responses": [
        {
          "action": "isolate",
          "event_id": "experiment-00517-C4-ryw-ryw-fault",
          "member": "mongo1",
          "ok": true
        }
      ],
      "start_ns": 8446618499407,
      "status": "APPLIED"
    },
    {
      "action": "heal",
      "applied_ns": 8446687449460,
      "end_ns": 8446687449728,
      "event_id": "experiment-00517-C4-ryw-ryw-fault-heal",
      "members": [
        "mongo1"
      ],
      "recovery_end_ns": 8446688596968,
      "recovery_start_ns": 8446687456733,
      "responses": [
        {
          "action": "heal",
          "event_id": "experiment-00517-C4-ryw-ryw-fault-heal",
          "member": "mongo1",
          "ok": true
        }
      ],
      "start_ns": 8446642176366,
      "status": "APPLIED"
    }
  ],
  "history_hash": "72f6c9f5640f7825eef8731ca1cf96cdaf4c9c985b88389ba781a895ec47089e",
  "manifest": {
    "adversarial": true,
    "campaign_id": "experiment",
    "causal_session": true,
    "checker_version": "history.v1",
    "cleanup_status": "STABLE",
    "configuration_id": "C4",
    "driver_version": "4.18.1",
    "image_digest": [
      "mongo@sha256:c1a84ab5d0c17deed1e0dba1d24bd7c76e5c7b281145fe536911939b1551754c"
    ],
    "members": [
      {
        "actual_role": "RSSecondary",
        "address": "mongo1:27017"
      },
      {
        "actual_role": "RSPrimary",
        "address": "mongo2:27017"
      },
      {
        "actual_role": "RSSecondary",
        "address": "mongo3:27017"
      }
    ],
    "namespace": {
      "collection": "logical",
      "database": "mc_experiment_00517_C4_ryw",
      "document_id": "experiment-00517-C4-ryw/x"
    },
    "prediction_commit": "8eb0ab28577acfb9dff179799aee2e7b447f978b",
    "prediction_manifest_hash": "663b06ed344c53ea75736e0322b3588ee94c5b8a2e344fc4710f0de925731857",
    "property": "RYW",
    "property_steps": {
      "read": "read",
      "write": "write"
    },
    "read_concern": "local",
    "retry_reads": false,
    "retry_writes": false,
    "runner_version": "8eb0ab28577acfb9dff179799aee2e7b447f978b",
    "schedule_id": "ryw-stale-secondary",
    "schema_version": "manifest.v1",
    "seed": 20261432,
    "session_id": "Binary(b'w\\xb7\\x18\\xc1c\\x03F\\x99\\xa6\\x85\\xaaG\\xf2\\x08\\xaew', 4)",
    "software_versions": {
      "docker_compose": "5.5.1",
      "docker_engine": "29.8.0",
      "mongodb": "7.0.34",
      "pymongo": "4.18.1",
      "python": "3.14.7"
    },
    "subtrial_finished_ns": 8446688600954,
    "subtrial_started_ns": 8446574189100,
    "timeout_policy": {
      "connect_ms": 2000,
      "election_barrier_ms": 30000,
      "operation_ms": 5000,
      "server_selection_ms": 5000,
      "subtrial_ms": 60000,
      "write_concern_ms": 5000
    },
    "trial_id": "experiment-00517-C4-ryw",
    "write_concern": "majority"
  },
  "metadata": {},
  "operations": [
    {
      "actual_role": "RSPrimary",
      "actual_server_address": "mongo2:27017",
      "causal_session": true,
      "command_name": "update",
      "dependency_metadata": {},
      "depends_on_read_id": null,
      "depends_on_version": null,
      "document_version_after": 0,
      "document_version_before": null,
      "end_ns": 8446617358834,
      "error_code": null,
      "error_message": null,
      "fault_event_id": null,
      "key": "x",
      "kind": "setup",
      "observed_updates": [],
      "observed_version": null,
      "observed_versions": [],
      "operation_id": "init",
      "operation_status": "SUCCESS",
      "parent_write_id": null,
      "property": "RYW",
      "read_concern": null,
      "requested_member": "primary",
      "response_received": true,
      "session_id": "Binary(b'w\\xb7\\x18\\xc1c\\x03F\\x99\\xa6\\x85\\xaaG\\xf2\\x08\\xaew', 4)",
      "start_ns": 8446594023080,
      "timeout_category": null,
      "trial_id": "experiment-00517-C4-ryw",
      "version": null,
      "write_concern": "majority",
      "write_id": null
    },
    {
      "actual_role": "RSPrimary",
      "actual_server_address": "mongo2:27017",
      "causal_session": true,
      "command_name": "update",
      "dependency_metadata": {
        "depends_on_read_id": null,
        "depends_on_version": null,
        "parent_write_id": null
      },
      "depends_on_read_id": null,
      "depends_on_version": null,
      "document_version_after": 1,
      "document_version_before": 0,
      "end_ns": 8446638326885,
      "error_code": null,
      "error_message": null,
      "fault_event_id": "experiment-00517-C4-ryw-ryw-fault",
      "key": "x",
      "kind": "write",
      "observed_updates": [],
      "observed_version": null,
      "observed_versions": [],
      "operation_id": "write",
      "operation_status": "SUCCESS",
      "parent_write_id": null,
      "property": "RYW",
      "read_concern": null,
      "requested_member": "primary",
      "response_received": true,
      "session_id": "Binary(b'w\\xb7\\x18\\xc1c\\x03F\\x99\\xa6\\x85\\xaaG\\xf2\\x08\\xaew', 4)",
      "start_ns": 8446633368285,
      "timeout_category": null,
      "trial_id": "experiment-00517-C4-ryw",
      "version": 1,
      "write_concern": "majority",
      "write_id": "w1"
    },
    {
      "actual_role": "RSSecondary",
      "actual_server_address": "mongo1:27017",
      "causal_session": true,
      "command_name": "find",
      "dependency_metadata": {},
      "depends_on_read_id": null,
      "depends_on_version": null,
      "document_version_after": 1,
      "document_version_before": null,
      "end_ns": 8446642004199,
      "error_code": null,
      "error_message": null,
      "fault_event_id": "experiment-00517-C4-ryw-ryw-fault",
      "key": "x",
      "kind": "read",
      "observed_updates": [
        {
          "depends_on_read_id": null,
          "depends_on_version": null,
          "effect": "initial",
          "parent_write_id": null,
          "version": 0,
          "write_id": "init"
        },
        {
          "depends_on_read_id": null,
          "depends_on_version": null,
          "effect": "set-v1",
          "parent_write_id": null,
          "version": 1,
          "write_id": "w1"
        }
      ],
      "observed_version": 1,
      "observed_versions": [
        0,
        1
      ],
      "operation_id": "read",
      "operation_status": "SUCCESS",
      "parent_write_id": null,
      "property": "RYW",
      "read_concern": "local",
      "requested_member": "mongo1",
      "response_received": true,
      "session_id": "Binary(b'w\\xb7\\x18\\xc1c\\x03F\\x99\\xa6\\x85\\xaaG\\xf2\\x08\\xaew', 4)",
      "start_ns": 8446641220336,
      "timeout_category": null,
      "trial_id": "experiment-00517-C4-ryw",
      "version": null,
      "write_concern": "majority",
      "write_id": null
    }
  ],
  "schema_version": "history.v1"
}
