{
  "fault_events": [
    {
      "action": "isolate",
      "applied_ns": 2136069301822,
      "end_ns": 2136069302146,
      "event_id": "experiment-01183-C3-ryw-ryw-fault",
      "members": [
        "mongo1"
      ],
      "responses": [
        {
          "action": "isolate",
          "event_id": "experiment-01183-C3-ryw-ryw-fault",
          "member": "mongo1",
          "ok": true
        }
      ],
      "start_ns": 2136041954879,
      "status": "APPLIED"
    },
    {
      "action": "heal",
      "applied_ns": 2136148527574,
      "end_ns": 2136148527887,
      "event_id": "experiment-01183-C3-ryw-ryw-fault-heal",
      "members": [
        "mongo1"
      ],
      "recovery_end_ns": 2136150813313,
      "recovery_start_ns": 2136148536843,
      "responses": [
        {
          "action": "heal",
          "event_id": "experiment-01183-C3-ryw-ryw-fault-heal",
          "member": "mongo1",
          "ok": true
        }
      ],
      "start_ns": 2136098281066,
      "status": "APPLIED"
    }
  ],
  "history_hash": "423d05577ad7d7483120db0edaf775b567cf2820b8ea2efc2d80f6fdea00b1bb",
  "manifest": {
    "adversarial": true,
    "campaign_id": "experiment",
    "campaign_ordinal": 1183,
    "causal_session": true,
    "checker_version": "history.v1",
    "cleanup_status": "STABLE",
    "configuration_id": "C3",
    "driver_version": "4.18.1",
    "image_digest": [
      "mongo@sha256:c1a84ab5d0c17deed1e0dba1d24bd7c76e5c7b281145fe536911939b1551754c"
    ],
    "members": [
      {
        "actual_role": "RSSecondary",
        "address": "mongo1:27017"
      },
      {
        "actual_role": "RSPrimary",
        "address": "mongo2:27017"
      },
      {
        "actual_role": "RSSecondary",
        "address": "mongo3:27017"
      }
    ],
    "namespace": {
      "collection": "logical",
      "database": "mc_experiment_01183_C3_ryw",
      "document_id": "experiment-01183-C3-ryw/x"
    },
    "prediction_commit": "7494c848ad37fc00e2cfe3df2b21c61a8074c0ae",
    "prediction_manifest_hash": "663b06ed344c53ea75736e0322b3588ee94c5b8a2e344fc4710f0de925731857",
    "property": "RYW",
    "property_steps": {
      "read": "read",
      "write": "write"
    },
    "read_concern": "majority",
    "retry_reads": false,
    "retry_writes": false,
    "runner_version": "7494c848ad37fc00e2cfe3df2b21c61a8074c0ae",
    "schedule_id": "ryw-stale-secondary",
    "schema_version": "manifest.v1",
    "seed": 20262098,
    "session_id": "Binary(b'\\xc59\\xe8CN\\xd5M\\x00\\x97b[\\xc4\\xcf\\xcc\\x10\\x1b', 4)",
    "software_versions": {
      "docker_compose": "5.5.1",
      "docker_engine": "29.8.0",
      "mongodb": "7.0.34",
      "pymongo": "4.18.1",
      "python": "3.14.7"
    },
    "subtrial_finished_ns": 2136150820753,
    "subtrial_started_ns": 2136001621693,
    "timeout_policy": {
      "connect_ms": 2000,
      "election_barrier_ms": 30000,
      "operation_ms": 5000,
      "server_selection_ms": 5000,
      "subtrial_ms": 60000,
      "write_concern_ms": 5000
    },
    "trial_id": "experiment-01183-C3-ryw",
    "write_concern": "w:1"
  },
  "metadata": {},
  "operations": [
    {
      "actual_role": "RSPrimary",
      "actual_server_address": "mongo2:27017",
      "causal_session": true,
      "command_name": "update",
      "dependency_metadata": {},
      "depends_on_read_id": null,
      "depends_on_version": null,
      "document_version_after": 0,
      "document_version_before": null,
      "end_ns": 2136041048231,
      "error_code": null,
      "error_message": null,
      "fault_event_id": null,
      "key": "x",
      "kind": "setup",
      "observed_updates": [],
      "observed_version": null,
      "observed_versions": [],
      "operation_id": "init",
      "operation_status": "SUCCESS",
      "parent_write_id": null,
      "property": "RYW",
      "read_concern": null,
      "requested_member": "primary",
      "response_received": true,
      "session_id": "Binary(b'\\xc59\\xe8CN\\xd5M\\x00\\x97b[\\xc4\\xcf\\xcc\\x10\\x1b', 4)",
      "start_ns": 2136022976846,
      "timeout_category": null,
      "trial_id": "experiment-01183-C3-ryw",
      "version": null,
      "write_concern": "w:1",
      "write_id": null
    },
    {
      "actual_role": "RSPrimary",
      "actual_server_address": "mongo2:27017",
      "causal_session": true,
      "command_name": "update",
      "dependency_metadata": {
        "depends_on_read_id": null,
        "depends_on_version": null,
        "parent_write_id": null
      },
      "depends_on_read_id": null,
      "depends_on_version": null,
      "document_version_after": 1,
      "document_version_before": 0,
      "end_ns": 2136071878970,
      "error_code": null,
      "error_message": null,
      "fault_event_id": "experiment-01183-C3-ryw-ryw-fault",
      "key": "x",
      "kind": "write",
      "observed_updates": [],
      "observed_version": null,
      "observed_versions": [],
      "operation_id": "write",
      "operation_status": "SUCCESS",
      "parent_write_id": null,
      "property": "RYW",
      "read_concern": null,
      "requested_member": "primary",
      "response_received": true,
      "session_id": "Binary(b'\\xc59\\xe8CN\\xd5M\\x00\\x97b[\\xc4\\xcf\\xcc\\x10\\x1b', 4)",
      "start_ns": 2136069874825,
      "timeout_category": null,
      "trial_id": "experiment-01183-C3-ryw",
      "version": 1,
      "write_concern": "w:1",
      "write_id": "w1"
    },
    {
      "actual_role": "RSSecondary",
      "actual_server_address": "mongo1:27017",
      "causal_session": true,
      "command_name": "find",
      "dependency_metadata": {},
      "depends_on_read_id": null,
      "depends_on_version": null,
      "document_version_after": 1,
      "document_version_before": null,
      "end_ns": 2136098016558,
      "error_code": null,
      "error_message": null,
      "fault_event_id": "experiment-01183-C3-ryw-ryw-fault",
      "key": "x",
      "kind": "read",
      "observed_updates": [
        {
          "depends_on_read_id": null,
          "depends_on_version": null,
          "effect": "initial",
          "parent_write_id": null,
          "version": 0,
          "write_id": "init"
        },
        {
          "depends_on_read_id": null,
          "depends_on_version": null,
          "effect": "set-v1",
          "parent_write_id": null,
          "version": 1,
          "write_id": "w1"
        }
      ],
      "observed_version": 1,
      "observed_versions": [
        0,
        1
      ],
      "operation_id": "read",
      "operation_status": "SUCCESS",
      "parent_write_id": null,
      "property": "RYW",
      "read_concern": "majority",
      "requested_member": "mongo1",
      "response_received": true,
      "session_id": "Binary(b'\\xc59\\xe8CN\\xd5M\\x00\\x97b[\\xc4\\xcf\\xcc\\x10\\x1b', 4)",
      "start_ns": 2136079609881,
      "timeout_category": null,
      "trial_id": "experiment-01183-C3-ryw",
      "version": null,
      "write_concern": "w:1",
      "write_id": null
    }
  ],
  "schema_version": "history.v1"
}
