{
  "fault_events": [],
  "history_hash": "55c08e24336a7eb3ad35e465ac0732a5fc753a67d70b361f8ecc4358e64bbe8b",
  "manifest": {
    "adversarial": false,
    "campaign_id": "experiment",
    "campaign_ordinal": 993,
    "causal_session": true,
    "checker_version": "history.v1",
    "configuration_id": "C6",
    "driver_version": "4.18.1",
    "image_digest": [
      "mongo@sha256:c1a84ab5d0c17deed1e0dba1d24bd7c76e5c7b281145fe536911939b1551754c"
    ],
    "members": [
      {
        "actual_role": "RSSecondary",
        "address": "mongo1:27017"
      },
      {
        "actual_role": "RSPrimary",
        "address": "mongo2:27017"
      },
      {
        "actual_role": "RSSecondary",
        "address": "mongo3:27017"
      }
    ],
    "namespace": {
      "collection": "logical",
      "database": "mc_experiment_00993_C6_mr",
      "document_id": "experiment-00993-C6-mr/x"
    },
    "prediction_commit": "e1bae03e82d1b372008ed3a64fc59c19c76c0a27",
    "prediction_manifest_hash": "663b06ed344c53ea75736e0322b3588ee94c5b8a2e344fc4710f0de925731857",
    "property": "MR",
    "property_steps": {
      "first_read": "first_read",
      "second_read": "second_read"
    },
    "read_concern": "majority",
    "retry_reads": false,
    "retry_writes": false,
    "runner_version": "e1bae03e82d1b372008ed3a64fc59c19c76c0a27",
    "schedule_id": "mr-stale-secondary",
    "schema_version": "manifest.v1",
    "seed": 20261908,
    "session_id": "Binary(b'\\xdb};5\\xcd?@\\xea\\xbf\\x9f0\\x0c\\xd1\\x9a\\xb3y', 4)",
    "software_versions": {
      "docker_compose": "5.5.1",
      "docker_engine": "29.8.0",
      "mongodb": "7.0.34",
      "pymongo": "4.18.1",
      "python": "3.14.7"
    },
    "subtrial_finished_ns": 12008826610252,
    "subtrial_started_ns": 12008718045385,
    "timeout_policy": {
      "connect_ms": 2000,
      "election_barrier_ms": 30000,
      "operation_ms": 5000,
      "server_selection_ms": 5000,
      "subtrial_ms": 60000,
      "write_concern_ms": 5000
    },
    "trial_id": "experiment-00993-C6-mr",
    "write_concern": "majority"
  },
  "metadata": {},
  "operations": [
    {
      "actual_role": "RSPrimary",
      "actual_server_address": "mongo2:27017",
      "causal_session": true,
      "command_name": "update",
      "dependency_metadata": {},
      "depends_on_read_id": null,
      "depends_on_version": null,
      "document_version_after": 0,
      "document_version_before": null,
      "end_ns": 12008806779210,
      "error_code": null,
      "error_message": null,
      "fault_event_id": null,
      "key": "x",
      "kind": "setup",
      "observed_updates": [],
      "observed_version": null,
      "observed_versions": [],
      "operation_id": "init",
      "operation_status": "SUCCESS",
      "parent_write_id": null,
      "property": "MR",
      "read_concern": null,
      "requested_member": "primary",
      "response_received": true,
      "session_id": "Binary(b'\\xdb};5\\xcd?@\\xea\\xbf\\x9f0\\x0c\\xd1\\x9a\\xb3y', 4)",
      "start_ns": 12008747951646,
      "timeout_category": null,
      "trial_id": "experiment-00993-C6-mr",
      "version": null,
      "write_concern": "majority",
      "write_id": null
    },
    {
      "actual_role": "RSPrimary",
      "actual_server_address": "mongo2:27017",
      "causal_session": true,
      "command_name": "update",
      "dependency_metadata": {
        "depends_on_read_id": null,
        "depends_on_version": null,
        "parent_write_id": null
      },
      "depends_on_read_id": null,
      "depends_on_version": null,
      "document_version_after": 1,
      "document_version_before": 0,
      "end_ns": 12008816752972,
      "error_code": null,
      "error_message": null,
      "fault_event_id": null,
      "key": "x",
      "kind": "write",
      "observed_updates": [],
      "observed_version": null,
      "observed_versions": [],
      "operation_id": "precondition_write",
      "operation_status": "SUCCESS",
      "parent_write_id": null,
      "property": "MR",
      "read_concern": null,
      "requested_member": "primary",
      "response_received": true,
      "session_id": "Binary(b'\\xdb};5\\xcd?@\\xea\\xbf\\x9f0\\x0c\\xd1\\x9a\\xb3y', 4)",
      "start_ns": 12008810830378,
      "timeout_category": null,
      "trial_id": "experiment-00993-C6-mr",
      "version": 1,
      "write_concern": "majority",
      "write_id": "prep"
    },
    {
      "actual_role": "RSSecondary",
      "actual_server_address": "mongo3:27017",
      "causal_session": true,
      "command_name": "find",
      "dependency_metadata": {},
      "depends_on_read_id": null,
      "depends_on_version": null,
      "document_version_after": 1,
      "document_version_before": null,
      "end_ns": 12008821326116,
      "error_code": null,
      "error_message": null,
      "fault_event_id": null,
      "key": "x",
      "kind": "read",
      "observed_updates": [
        {
          "depends_on_read_id": null,
          "depends_on_version": null,
          "effect": "initial",
          "parent_write_id": null,
          "version": 0,
          "write_id": "init"
        },
        {
          "depends_on_read_id": null,
          "depends_on_version": null,
          "effect": "set-v1",
          "parent_write_id": null,
          "version": 1,
          "write_id": "prep"
        }
      ],
      "observed_version": 1,
      "observed_versions": [
        0,
        1
      ],
      "operation_id": "first_read",
      "operation_status": "SUCCESS",
      "parent_write_id": null,
      "property": "MR",
      "read_concern": "majority",
      "requested_member": "mongo3",
      "response_received": true,
      "session_id": "Binary(b'\\xdb};5\\xcd?@\\xea\\xbf\\x9f0\\x0c\\xd1\\x9a\\xb3y', 4)",
      "start_ns": 12008819833491,
      "timeout_category": null,
      "trial_id": "experiment-00993-C6-mr",
      "version": null,
      "write_concern": "majority",
      "write_id": null
    },
    {
      "actual_role": "RSSecondary",
      "actual_server_address": "mongo1:27017",
      "causal_session": true,
      "command_name": "find",
      "dependency_metadata": {},
      "depends_on_read_id": null,
      "depends_on_version": null,
      "document_version_after": 1,
      "document_version_before": null,
      "end_ns": 12008826436219,
      "error_code": null,
      "error_message": null,
      "fault_event_id": null,
      "key": "x",
      "kind": "read",
      "observed_updates": [
        {
          "depends_on_read_id": null,
          "depends_on_version": null,
          "effect": "initial",
          "parent_write_id": null,
          "version": 0,
          "write_id": "init"
        },
        {
          "depends_on_read_id": null,
          "depends_on_version": null,
          "effect": "set-v1",
          "parent_write_id": null,
          "version": 1,
          "write_id": "prep"
        }
      ],
      "observed_version": 1,
      "observed_versions": [
        0,
        1
      ],
      "operation_id": "second_read",
      "operation_status": "SUCCESS",
      "parent_write_id": null,
      "property": "MR",
      "read_concern": "majority",
      "requested_member": "mongo1",
      "response_received": true,
      "session_id": "Binary(b'\\xdb};5\\xcd?@\\xea\\xbf\\x9f0\\x0c\\xd1\\x9a\\xb3y', 4)",
      "start_ns": 12008824964520,
      "timeout_category": null,
      "trial_id": "experiment-00993-C6-mr",
      "version": null,
      "write_concern": "majority",
      "write_id": null
    }
  ],
  "schema_version": "history.v1"
}
