{
  "fault_events": [
    {
      "action": "isolate",
      "applied_ns": 6500100372960,
      "end_ns": 6500100373277,
      "event_id": "experiment-00169-C1-mr-mr-fault",
      "members": [
        "mongo1"
      ],
      "responses": [
        {
          "action": "isolate",
          "event_id": "experiment-00169-C1-mr-mr-fault",
          "member": "mongo1",
          "ok": true
        }
      ],
      "start_ns": 6500077748103,
      "status": "APPLIED"
    },
    {
      "action": "heal",
      "applied_ns": 6500145006260,
      "end_ns": 6500145006498,
      "event_id": "experiment-00169-C1-mr-mr-fault-heal",
      "members": [
        "mongo1"
      ],
      "recovery_end_ns": 6500146923183,
      "recovery_start_ns": 6500145013582,
      "responses": [
        {
          "action": "heal",
          "event_id": "experiment-00169-C1-mr-mr-fault-heal",
          "member": "mongo1",
          "ok": true
        }
      ],
      "start_ns": 6500109957492,
      "status": "APPLIED"
    }
  ],
  "history_hash": "59078b4b037459eb1711d62629300394ac90662375024de28b1d30e6521b900b",
  "manifest": {
    "adversarial": true,
    "campaign_id": "experiment",
    "causal_session": false,
    "checker_version": "history.v1",
    "cleanup_status": "STABLE",
    "configuration_id": "C1",
    "driver_version": "4.18.1",
    "image_digest": [
      "mongo@sha256:c1a84ab5d0c17deed1e0dba1d24bd7c76e5c7b281145fe536911939b1551754c"
    ],
    "members": [
      {
        "actual_role": "RSSecondary",
        "address": "mongo1:27017"
      },
      {
        "actual_role": "RSPrimary",
        "address": "mongo2:27017"
      },
      {
        "actual_role": "RSSecondary",
        "address": "mongo3:27017"
      }
    ],
    "namespace": {
      "collection": "logical",
      "database": "mc_experiment_00169_C1_mr",
      "document_id": "experiment-00169-C1-mr/x"
    },
    "prediction_commit": "8eb0ab28577acfb9dff179799aee2e7b447f978b",
    "prediction_manifest_hash": "663b06ed344c53ea75736e0322b3588ee94c5b8a2e344fc4710f0de925731857",
    "property": "MR",
    "property_steps": {
      "first_read": "first_read",
      "second_read": "second_read"
    },
    "read_concern": "local",
    "retry_reads": false,
    "retry_writes": false,
    "runner_version": "8eb0ab28577acfb9dff179799aee2e7b447f978b",
    "schedule_id": "mr-stale-secondary",
    "schema_version": "manifest.v1",
    "seed": 20261084,
    "session_id": "Binary(b'?\\xda\\xb40z2A\\xdb\\xadb\\x12\\xc4\\xacR\\xe3\\x1c', 4)",
    "software_versions": {
      "docker_compose": "5.5.1",
      "docker_engine": "29.8.0",
      "mongodb": "7.0.34",
      "pymongo": "4.18.1",
      "python": "3.14.7"
    },
    "subtrial_finished_ns": 6500146928512,
    "subtrial_started_ns": 6500041675822,
    "timeout_policy": {
      "connect_ms": 2000,
      "election_barrier_ms": 30000,
      "operation_ms": 5000,
      "server_selection_ms": 5000,
      "subtrial_ms": 60000,
      "write_concern_ms": 5000
    },
    "trial_id": "experiment-00169-C1-mr",
    "write_concern": "w:1"
  },
  "metadata": {},
  "operations": [
    {
      "actual_role": "RSPrimary",
      "actual_server_address": "mongo2:27017",
      "causal_session": false,
      "command_name": "update",
      "dependency_metadata": {},
      "depends_on_read_id": null,
      "depends_on_version": null,
      "document_version_after": 0,
      "document_version_before": null,
      "end_ns": 6500072761589,
      "error_code": null,
      "error_message": null,
      "fault_event_id": null,
      "key": "x",
      "kind": "setup",
      "observed_updates": [],
      "observed_version": null,
      "observed_versions": [],
      "operation_id": "init",
      "operation_status": "SUCCESS",
      "parent_write_id": null,
      "property": "MR",
      "read_concern": null,
      "requested_member": "primary",
      "response_received": true,
      "session_id": "Binary(b'?\\xda\\xb40z2A\\xdb\\xadb\\x12\\xc4\\xacR\\xe3\\x1c', 4)",
      "start_ns": 6500058023939,
      "timeout_category": null,
      "trial_id": "experiment-00169-C1-mr",
      "version": null,
      "write_concern": "w:1",
      "write_id": null
    },
    {
      "actual_role": "RSPrimary",
      "actual_server_address": "mongo2:27017",
      "causal_session": false,
      "command_name": "update",
      "dependency_metadata": {
        "depends_on_read_id": null,
        "depends_on_version": null,
        "parent_write_id": null
      },
      "depends_on_read_id": null,
      "depends_on_version": null,
      "document_version_after": 1,
      "document_version_before": 0,
      "end_ns": 6500077665826,
      "error_code": null,
      "error_message": null,
      "fault_event_id": null,
      "key": "x",
      "kind": "write",
      "observed_updates": [],
      "observed_version": null,
      "observed_versions": [],
      "operation_id": "precondition_write",
      "operation_status": "SUCCESS",
      "parent_write_id": null,
      "property": "MR",
      "read_concern": null,
      "requested_member": "primary",
      "response_received": true,
      "session_id": "Binary(b'?\\xda\\xb40z2A\\xdb\\xadb\\x12\\xc4\\xacR\\xe3\\x1c', 4)",
      "start_ns": 6500076313373,
      "timeout_category": null,
      "trial_id": "experiment-00169-C1-mr",
      "version": 1,
      "write_concern": "w:1",
      "write_id": "prep"
    },
    {
      "actual_role": "RSSecondary",
      "actual_server_address": "mongo3:27017",
      "causal_session": false,
      "command_name": "find",
      "dependency_metadata": {},
      "depends_on_read_id": null,
      "depends_on_version": null,
      "document_version_after": 1,
      "document_version_before": null,
      "end_ns": 6500106314981,
      "error_code": null,
      "error_message": null,
      "fault_event_id": "experiment-00169-C1-mr-mr-fault",
      "key": "x",
      "kind": "read",
      "observed_updates": [
        {
          "depends_on_read_id": null,
          "depends_on_version": null,
          "effect": "initial",
          "parent_write_id": null,
          "version": 0,
          "write_id": "init"
        },
        {
          "depends_on_read_id": null,
          "depends_on_version": null,
          "effect": "set-v1",
          "parent_write_id": null,
          "version": 1,
          "write_id": "prep"
        }
      ],
      "observed_version": 1,
      "observed_versions": [
        0,
        1
      ],
      "operation_id": "first_read",
      "operation_status": "SUCCESS",
      "parent_write_id": null,
      "property": "MR",
      "read_concern": "local",
      "requested_member": "mongo3",
      "response_received": true,
      "session_id": "Binary(b'?\\xda\\xb40z2A\\xdb\\xadb\\x12\\xc4\\xacR\\xe3\\x1c', 4)",
      "start_ns": 6500105460380,
      "timeout_category": null,
      "trial_id": "experiment-00169-C1-mr",
      "version": null,
      "write_concern": "w:1",
      "write_id": null
    },
    {
      "actual_role": "RSSecondary",
      "actual_server_address": "mongo1:27017",
      "causal_session": false,
      "command_name": "find",
      "dependency_metadata": {},
      "depends_on_read_id": null,
      "depends_on_version": null,
      "document_version_after": 1,
      "document_version_before": null,
      "end_ns": 6500109830629,
      "error_code": null,
      "error_message": null,
      "fault_event_id": "experiment-00169-C1-mr-mr-fault",
      "key": "x",
      "kind": "read",
      "observed_updates": [
        {
          "depends_on_read_id": null,
          "depends_on_version": null,
          "effect": "initial",
          "parent_write_id": null,
          "version": 0,
          "write_id": "init"
        },
        {
          "depends_on_read_id": null,
          "depends_on_version": null,
          "effect": "set-v1",
          "parent_write_id": null,
          "version": 1,
          "write_id": "prep"
        }
      ],
      "observed_version": 1,
      "observed_versions": [
        0,
        1
      ],
      "operation_id": "second_read",
      "operation_status": "SUCCESS",
      "parent_write_id": null,
      "property": "MR",
      "read_concern": "local",
      "requested_member": "mongo1",
      "response_received": true,
      "session_id": "Binary(b'?\\xda\\xb40z2A\\xdb\\xadb\\x12\\xc4\\xacR\\xe3\\x1c', 4)",
      "start_ns": 6500108684326,
      "timeout_category": null,
      "trial_id": "experiment-00169-C1-mr",
      "version": null,
      "write_concern": "w:1",
      "write_id": null
    }
  ],
  "schema_version": "history.v1"
}
